{"clearing_scale":{"minimal":false,"value":"1"},"format":"hec-count-proof/1","function":{"extension":{"kind":"cancel-fill-common-threshold/1"},"kind":"compatible-reconstruction-pipeline/1","seed":{"kind":"compatible-count-table/1","rows":{"count":64,"data":"AIAAAgYQKGDgAAEDhgwYMuTIgIABEwYYOHBggEEDBwwcMHTIAIECBg6UKHCggEEDBwwcMHTIgIEDBwYcKHjgoFGDBw0eNHzY","encoding":"bounded-integers/1"}}},"inequality":{"coefficients":["-1","-1","-1","-1","0","0","0","1","-1","1","0","0","0","0","-1","0","0","1","0","1","1","0","-1","1","1","0","0","-1","-1","0","0"],"n":5}}
